[
  {
    "id": "event_001",
    "title": "东湖早口约钓",
    "organizer_id": "demo_user",
    "organizer_name": "武汉钓友 008",
    "city": "武汉市",
    "water_name": "东湖听涛景区",
    "event_time": "2026-06-20T05:30:00+08:00",
    "duration_hours": 5,
    "max_participants": 10,
    "current_participants": 3,
    "fee": 0,
    "safety_requirements": "穿救生衣，注意岸边湿滑",
    "description": "周末清晨窗口期约钓，目标鲫鱼和翘嘴。",
    "group_id": "group_001",
    "status": "open",
    "created_at": "2026-06-10T00:00:00+00:00",
    "updated_at": "2026-06-10T00:00:00+00:00"
  },
  {
    "id": "event_002",
    "title": "南湖新手调漂练习局",
    "organizer_id": "user_aming",
    "organizer_name": "不空军的阿明",
    "city": "武汉市",
    "water_name": "南湖练竿塘",
    "event_time": "2026-06-21T14:00:00+08:00",
    "duration_hours": 3,
    "max_participants": 8,
    "current_participants": 5,
    "fee": 39,
    "safety_requirements": "自备遮阳帽和饮用水",
    "description": "面向第一次台钓的新手，现场完成找底、调目、钓目。",
    "group_id": null,
    "status": "open",
    "created_at": "2026-06-11T00:00:00+00:00",
    "updated_at": "2026-06-11T00:00:00+00:00"
  },
  {
    "id": "event_003",
    "title": "青山江滩傍晚路亚搜索",
    "organizer_id": "user_jiangfeng",
    "organizer_name": "江风路亚",
    "city": "武汉市",
    "water_name": "青山江滩",
    "event_time": "2026-06-22T17:30:00+08:00",
    "duration_hours": 2,
    "max_participants": 6,
    "current_participants": 3,
    "fee": 0,
    "safety_requirements": "必须穿救生衣，禁止涉水",
    "description": "沿江滩缓流区搜索翘嘴，交流亮片和米诺使用方式。",
    "group_id": null,
    "status": "open",
    "created_at": "2026-06-12T00:00:00+00:00",
    "updated_at": "2026-06-12T00:00:00+00:00"
  }
]